Title,Links,Description
Linux Mint: Main Page,https://linuxmint.com/,"Linux Mint is an elegant, easy to use, up to date and comfortable GNU/Linux desktop distribution."
Linux Mint - Wikipedia,https://en.wikipedia.org/wiki/Linux_Mint,"Linux Mint is a community-driven Linux distribution based on Ubuntu (in turn based on Debian), bundled with a variety of free and open-source applications.Initial release: August 27, 2006; 14 years agoUpdate method: APT (+ Software Manager, Up...‎Platforms: x86-64, ‎arm64‎Default user interface: 1.0: KDE‎; 2.0-12: ‎GNO...‎"
Linux Mint - DistroWatch.com,https://distrowatch.com/mint,"16-Jan-2021 — Linux Mint is an Ubuntu-based distribution whose goal is to provide a classic desktop experience with many convenient, custom tools and ..."
Choose the right edition — Linux Mint Installation Guide ...,https://linuxmint-installation-guide.readthedocs.io/en/latest/choose.html,"The most popular version of Linux Mint is the Cinnamon edition. Cinnamon is primarily developed for and by Linux Mint. It is slick, beautiful, and full of new ...MATE: A more stable, and faster desktopXfce: The most lightweight and the most stableCinnamon: The most modern, innovative and f..."
Install Linux Mint — Linux Mint Installation Guide documentation,https://linuxmint-installation-guide.readthedocs.io/en/latest/install.html,"When you boot the computer from the USB stick (or DVD), Linux Mint starts a live session . It logs you in automatically as a user called mint and shows you a ..."
"Linux Mint Reviews 2021: Details, Pricing, & Features | G2",https://www.g2.com/products/linux-mint/reviews,Linux mint is very easy to install and setup. It is a virus free operating system which makes it more secure. It's graphics are very good and different from other ... Rating: 4.5 · ‎65 reviews
Linux Mint 20: My Top Linux Distro - YouTube,https://www.youtube.com/watch?v=Z_ZAH7LWl-o,"16:54Linux Mint 20 review and demo, including specifications, new interface settings, Warpinator, a comparison of ...19-Jul-2020 · Uploaded by ExplainingComputers"
"Linux Mint Reviews 2021: Details, Pricing, & Features | G2",https://www.g2.com/products/linux-mint/reviews,Linux mint is very easy to install and setup. It is a virus free operating system which makes it more secure. It's graphics are very good and different from other ...
Installing snap on Linux Mint | Snapcraft documentation,https://snapcraft.io/docs/installing-snap-on-linux-mint,"Snap is available for Linux Mint 18.2 (Sonya), Linux Mint 18.3 (Sylvia), Linux Mint 19 (Tara), Linux Mint 19.1 (Tessa) and the latest release, Linux Mint 20 ..."
Linux Mint Cinnamon vs MATE vs Xfce: Which One to Use?,https://itsfoss.com/linux-mint-cinnamon-mate-xfce/,"20-Mar-2021 — Confused with the available choices of Cinnamon, MATE and Xfce variants in Linux Mint? Let me help you with which Linux Mint version ..."
Linux Mint · GitHub,https://github.com/linuxmint,https://www.linuxmint.com. Linux Mint has 124 repositories available. Follow their code on GitHub.
Linux Mint 20: Still the best Linux desktop despite one quirk ...,https://www.zdnet.com/article/mint-20-jpglinux-mint-20-still-the-best-linux-desktop-despite-one-quirk/,"01-Jul-2020 — As usual, Linux Mint's latest release, Mint 20, is better than ever, but its developers' refusal to make it easy to use Ubuntu Snap is a trifle ..."
10 Reasons Why Linux Mint Is More Popular Than Ubuntu,https://www.fossmint.com/reasons-to-use-linux-mint/,20-Apr-2021 — Linux Mint is a community-driven Linux distribution with a major focus on making open-source goodies freely available and easily accessible in ...
Linux Mint | Linux Wiki | Fandom,https://linux.fandom.com/wiki/Linux_Mint,"Linux Mint is a Linux distro based on Ubuntu. It has a choice of desktops, including Cinnamon (the default), MATE and Xfce. Since Linux Mint 19, the KDE edition ...Next Release: 21Release Date: 27 June 2020"
What is Linux Mint? | Edureka - Medium,https://medium.com/edureka/linux-mint-904d4de15c58,"18-Oct-2019 — Linux Mint is a community-driven Linux distribution that is based on Ubuntu. It strives to be a modern, elegant and comfortable operating system ..."
Linux Mint History and Development | Unixmen,https://www.unixmen.com/linux-mint-history-development/,Linux Mint was mainly developed and released by Clement Lefebvre in France in 2006. Clement is one of the software developers who are notoriously reluctant ...
Linux Mint - Home | Facebook,https://www.facebook.com/Linux-Mint-185238108180410/,"Linux Mint. 139533 likes · 132 talking about this. Linux Mint is a leading desktop distribution, used by millions of people and one of the most popular..."
Linux Mint 20.1 is a desktop anyone can love - TechRepublic,https://www.techrepublic.com/article/linux-mint-20-1-is-a-desktop-anyone-can-love/,20-Jan-2021 — Jack Wallen kicks the tires of Linux Mint 20.1 and comes away astonished at what the developers have accomplished.
Linux Mint (@Linux_Mint) | Twitter,https://twitter.com/linux_mint?lang=en,The latest Tweets from Linux Mint (@Linux_Mint). Official Twitter Account for Linux Mint. Worldwide.
linuxmint.org,https://linuxmint.org/,linuxmint.org. you're probably looking for linuxmint.com.
10 Things to Do First in Linux Mint ... - Easy Linux Tips Project,https://easylinuxtipsproject.blogspot.com/p/first-mint-cinnamon.html,"Congratulations, you have installed a brand new Linux Mint 20.1 (code name: Ulyssa), with the Cinnamon desktop! What's best for you to do, first of all?"
Linux Mint - Reddit,https://www.reddit.com/r/linuxmint/,"r/linuxmint: News, Discussion, and Support for Linux Mint The Linux Mint Subreddit: for news, discussion and support for the Linux distribution …"
Linux Mint review: Fresh and funky | IT PRO,https://www.itpro.co.uk/software/linux/357106/linux-mint-review-fresh-and-funky,"15-Sep-2020 — It's not quite as fresh as some of its rivals, but Linux Mint will make Windows switchers feel right at home."
"Linux Mint 20.1 Available to Download, This is What's New ...",https://www.omgubuntu.co.uk/2021/01/linux-mint-20-1-download,"08-Jan-2021 — Linux Mint 20.1 is now available to download. Learn more about the new releases, including its new features, new apps, and key changes in ..."
Linux Mint 20 Cinnamon Latest Version for ... - Amazon.com,https://www.amazon.com/Linux-Cinnamon-Latest-Version-Bootable/dp/B08L2KVCCX,This is the full and latest version of the Mint OS for desktop PCs and laptops: Linux Mint 20 Ulyana; Linux Mint is a community-driven Linux distribution based on ...
How to Install Git on Linux Mint 20 – Linux Hint,https://linuxhint.com/install-git-linux-mint/,"17-Feb-2021 — The Git is included in Linux Mint 20 standard repositories can be installed easily using the apt command. As always, update and upgrade your ..."
Install on Linux Mint | KiCad EDA,https://www.kicad.org/download/linux-mint/,Linux Mint Debian does not work with the PPA listed below. Only Linux Mint Ubuntu and its derivatives have been reported to work with this PPA. 5.1.10 Stable ...
"The 5 best Linux distros for the enterprise: Red Hat, Ubuntu ...",https://www.computerworld.com/article/3245645/the-5-best-linux-distros-for-work-red-hat-suse-ubuntu-linux-mint-and-tens.html,"Linux Mint — The 5 best Linux distros for the enterprise: Red Hat, Ubuntu, Linux Mint and more​. A variety of high-quality Linux distributions allow you ..."
Check Linux Mint Version - LinuxConfig.org,https://linuxconfig.org/check-linux-mint-version,01-Jul-2019 — This tutorial will provide the reader with an information on how to check version of the Linux Mint operating system.System: Red Hat Enterprise Linux 8Other: Privileged access to your Linux system as ...
Linux Mint Resources - GCFLearnFree.org,https://edu.gcfglobal.org/en/linux-mint-resources/linux-mint-resources/1/,"Linux Mint Resources. If you're looking for a free operating system or you just want to try something different from Windows or Mac OS X, Linux Mint is a great ..."
How to switch an old Windows laptop to Linux - The Verge,https://www.theverge.com/21550815/windows-microsoft-linux-mint-laptop-how-to-switch,"06-Nov-2020 — Another advantage, which Mint shares with other Linux distros, is it runs on low-​power hardware. You can run Mint on any of your Windows 7 PCs ..."
Linux Mint VM images for VMware and VirtualBox - OSBoxes,https://www.osboxes.org/linux-mint/,"01-May-2021 — Linux Mint cinnamon and mate images (VHD, VDI, VMDK) for VMware and VirtualBox. Download and virtualize Linux Mint under your primary ..."
Linux Mint Vs Ubuntu: Which Operating System Is Better?,https://analyticsindiamag.com/linux-mint-vs-ubuntu-which-os-is-better/,"11-Apr-2019 — Mint, as well as Ubuntu, are two of the most popular Linux distros which offer a high degree of usability to its users."
How to Upgrade to Linux Mint 20 Ulyana - Tecmint,https://www.tecmint.com/upgrade-to-linux-mint-20/,"11-Jul-2020 — In this guide, you will learn how to Upgrade Linux Mint 19.3, codenamed Tricia, to Linux Mint 20 which is based on Ubuntu 20.04."
Tutorial: Install Linux Mint on a Windows Laptop Using a USB ...,https://thenewstack.io/tutorial-install-linux-mint-on-a-windows-laptop-using-a-usb-stick/,24-Sep-2019 — The long process of installing Linux MInt on a Dell laptop through a USB stick.
What is Linux Mint? - Definition from Techopedia,https://www.techopedia.com/definition/28288/linux-mint,"Linux Mint is a Linux operating system (OS) variant designed on the kernel architecture of Ubuntu and Debian operating systems, which are Linux derivatives."
"Linux Mint 19.1: A sneaky popular distro skips upheaval, offers ...",https://arstechnica.com/gadgets/2019/01/linux-mint-19-1-a-sneaky-popular-distro-skips-upheaval-offers-small-upgrades/,"28-Jan-2019 — Anecdotally, Mint feels like one of Linux's most popular distros—updates like 19.1 show why."
Linux Scanner Driver Download | Epson - Printer & Imaging ...,https://support.epson.net/linux/en/imagescanv3.php,"Linux Mint — Distribution, Architecture. Linux Mint 19(LTS), 32bit (i386), download. 64bit(amd64), download. Linux Mint 20(LTS), 64bit(amd64) ..."
Linux mint update grub,https://tenutemartoccia.it/linux-mint-update-grub.html,"linux mint update grub, 13/5/2013 · In Linux Mint: sudo pluma /etc/sysctl.conf Locate this line (if not found, add it): vm.swappiness=10 Save the file and reboot the ..."
Linux Mint 20 (Ulyana) Installation Steps with Screenshots,https://www.linuxtechi.com/linux-mint-20-installation-steps-screenshots/,28-Jun-2020 — Step by step Linux Mint 20 (Ulyana) installation guide with screenshots for your laptop and desktop.
MintGuide.Org • The kindest blog about Linux Mint,https://mintguide.org/,"Linux Mint Guide is your reliable assistant for travelling into Linux Mint world. In our blog you can find a lot of news, articles, how to's, advices, tips'n'tricks which ..."
What's new in Linux Mint 20.1 Ulyssa and how to install it ...,https://olhardigital.com.br/en/2021/01/07/dicas-e-tutoriais/como-instalar-o-linux-mint-20-1-no-computador/,07-Jan-2021 — The Linux Mint 20.1 Ulyssa just came out and has several interesting news for its users. See how to install the new version!
Q&A: Clement Lefebvre: The man behind Linux Mint | Network ...,https://www.networkworld.com/article/2170903/q-a--clement-lefebvre--the-man-behind-linux-mint.html,"21-Oct-2013 — Linux Mint, an Ubuntu and Debian-based Linux distribution, has seen tremendous growth in community support and installed base in recent ..."
Intel: Installing Linux Mint 19.3 - fit-PC wiki,https://www.fit-pc.com/wiki/index.php?title=Intel:_Installing_Linux_Mint_19.3,"Base installation of Linux Mint. Boot the machine from the flash drive: fitlet2 - Press ""F7"" for one time boot menu or change boot priority ..."
Install Linux Mint's New Cinnamon Desktop on Ubuntu,https://www.howtogeek.com/103691/install-linux-mints-new-cinnamon-desktop-on-ubuntu/,"27-Jan-2012 — Tired of Ubuntu's Unity desktop environment? Try Cinnamon, the latest desktop environment from Linux Mint. Cinnamon offers a more ..."
Linux Mint 18 Cinnamon 64 bit (DVD): Amazon.in: Software,https://www.amazon.in/Linux-Mint-Cinnamon-bit-DVD/dp/B01N64NMTI,Linux Mint 18 Cinnamon 64 bit (DVD): Amazon.in: Software.
